{"certificates":[{"actions":[0,1,2],"choice":1,"domain":0,"event":0,"id":"local-0-1","request":0,"transport":0,"unavailablePlacements":[]},{"actions":[3,4,5],"choice":2,"domain":0,"event":1,"id":"local-0-2","request":1,"transport":0,"unavailablePlacements":[]},{"actions":[6,7,8],"choice":3,"domain":0,"event":2,"id":"local-0-3","request":2,"transport":1,"unavailablePlacements":[]},{"actions":[9,10,11],"choice":4,"domain":0,"event":3,"id":"local-0-4","request":3,"transport":2,"unavailablePlacements":[]},{"actions":[12,13,14],"choice":5,"domain":0,"event":4,"id":"local-0-5","request":4,"transport":2,"unavailablePlacements":[]},{"actions":[15,16,17],"choice":6,"domain":0,"event":5,"id":"local-0-6","request":5,"transport":3,"unavailablePlacements":[]},{"actions":[18,19,20],"choice":7,"domain":0,"event":6,"id":"local-0-7","request":6,"transport":4,"unavailablePlacements":[]},{"actions":[21,22,23],"choice":8,"domain":0,"event":7,"id":"local-0-8","request":7,"transport":4,"unavailablePlacements":[]},{"actions":[24,25,26],"choice":9,"domain":0,"event":8,"id":"local-0-9","request":8,"transport":5,"unavailablePlacements":[]},{"actions":[27,28,29],"choice":1,"domain":1,"event":0,"id":"local-1-1","request":0,"transport":6,"unavailablePlacements":[]},{"actions":[30,31,32],"choice":2,"domain":1,"event":1,"id":"local-1-2","request":1,"transport":6,"unavailablePlacements":[]},{"actions":[33,34,35],"choice":3,"domain":1,"event":2,"id":"local-1-3","request":2,"transport":7,"unavailablePlacements":[]},{"actions":[36,37,38],"choice":4,"domain":1,"event":3,"id":"local-1-4","request":3,"transport":8,"unavailablePlacements":[]},{"actions":[39,40,41],"choice":5,"domain":1,"event":4,"id":"local-1-5","request":4,"transport":8,"unavailablePlacements":[]},{"actions":[42,43,44],"choice":6,"domain":1,"event":5,"id":"local-1-6","request":5,"transport":9,"unavailablePlacements":[]},{"actions":[45,46,47],"choice":7,"domain":1,"event":6,"id":"local-1-7","request":6,"transport":10,"unavailablePlacements":[]},{"actions":[48,49,50],"choice":8,"domain":1,"event":7,"id":"local-1-8","request":7,"transport":10,"unavailablePlacements":[]},{"actions":[51,52,53],"choice":9,"domain":1,"event":8,"id":"local-1-9","request":8,"transport":11,"unavailablePlacements":[]},{"actions":[54,55],"choice":1,"domain":2,"event":0,"id":"local-2-1","request":0,"transport":12,"unavailablePlacements":[]},{"actions":[56,57],"choice":2,"domain":2,"event":1,"id":"local-2-2","request":1,"transport":12,"unavailablePlacements":[]},{"actions":[58,59],"choice":3,"domain":2,"event":2,"id":"local-2-3","request":2,"transport":13,"unavailablePlacements":[]},{"actions":[60,61],"choice":4,"domain":2,"event":3,"id":"local-2-4","request":3,"transport":14,"unavailablePlacements":[]},{"actions":[62,63],"choice":5,"domain":2,"event":4,"id":"local-2-5","request":4,"transport":14,"unavailablePlacements":[]},{"actions":[64,65],"choice":6,"domain":2,"event":5,"id":"local-2-6","request":5,"transport":13,"unavailablePlacements":[]},{"actions":[66,67],"choice":7,"domain":2,"event":6,"id":"local-2-7","request":6,"transport":15,"unavailablePlacements":[]},{"actions":[68,69],"choice":8,"domain":2,"event":7,"id":"local-2-8","request":7,"transport":15,"unavailablePlacements":[]},{"actions":[70,71],"choice":9,"domain":2,"event":8,"id":"local-2-9","request":8,"transport":13,"unavailablePlacements":[]}],"contractVersion":2,"domains":[{"choiceSlot":0,"id":"cone","ports":["0"]},{"choiceSlot":1,"id":"edge","ports":["0","1"]},{"choiceSlot":2,"id":"vertex","ports":["0","1","2"]}],"executionDigest":"a576a2f9fa894d715742667bc4ed0293d05868145f5f014cd3495f6d40d2dc39","interpretationDigest":"1d70d7bddc6a639f16c8b8cf9b78c2dc213f9140dd06a6eda7286d1e283b2f33","kind":"twisty-interpretation","pieces":[{"domain":0,"piece":0,"portLabels":[{"material":"A","port":"0"}]},{"domain":0,"piece":1,"portLabels":[{"material":"C","port":"0"}]},{"domain":0,"piece":2,"portLabels":[{"material":"B","port":"0"}]},{"domain":1,"piece":3,"portLabels":[{"material":"A","port":"0"},{"material":"C","port":"1"}]},{"domain":1,"piece":4,"portLabels":[{"material":"B","port":"0"},{"material":"A","port":"1"}]},{"domain":1,"piece":5,"portLabels":[{"material":"B","port":"0"},{"material":"C","port":"1"}]},{"domain":2,"piece":6,"portLabels":[{"material":"B","port":"0"},{"material":"C","port":"1"},{"material":"A","port":"2"}]},{"domain":2,"piece":7,"portLabels":[{"material":"A","port":"0"},{"material":"C","port":"1"},{"material":"B","port":"2"}]}],"placements":[{"domain":0,"placement":0,"ports":[{"attachment":"A","id":"0","resource":0}],"resources":[0]},{"domain":0,"placement":1,"ports":[{"attachment":"A","id":"0","resource":0}],"resources":[0]},{"domain":0,"placement":2,"ports":[{"attachment":"C","id":"0","resource":1}],"resources":[1]},{"domain":0,"placement":3,"ports":[{"attachment":"C","id":"0","resource":1}],"resources":[1]},{"domain":0,"placement":4,"ports":[{"attachment":"B","id":"0","resource":2}],"resources":[2]},{"domain":0,"placement":5,"ports":[{"attachment":"B","id":"0","resource":2}],"resources":[2]},{"domain":1,"placement":6,"ports":[{"attachment":"A","id":"0","resource":3},{"attachment":"C","id":"1","resource":3}],"resources":[3]},{"domain":1,"placement":7,"ports":[{"attachment":"C","id":"0","resource":3},{"attachment":"A","id":"1","resource":3}],"resources":[3]},{"domain":1,"placement":8,"ports":[{"attachment":"B","id":"0","resource":4},{"attachment":"A","id":"1","resource":4}],"resources":[4]},{"domain":1,"placement":9,"ports":[{"attachment":"A","id":"0","resource":4},{"attachment":"B","id":"1","resource":4}],"resources":[4]},{"domain":1,"placement":10,"ports":[{"attachment":"B","id":"0","resource":5},{"attachment":"C","id":"1","resource":5}],"resources":[5]},{"domain":1,"placement":11,"ports":[{"attachment":"C","id":"0","resource":5},{"attachment":"B","id":"1","resource":5}],"resources":[5]},{"domain":2,"placement":12,"ports":[{"attachment":"B","id":"0","resource":6},{"attachment":"C","id":"1","resource":6},{"attachment":"A","id":"2","resource":6}],"resources":[6]},{"domain":2,"placement":13,"ports":[{"attachment":"C","id":"0","resource":6},{"attachment":"A","id":"1","resource":6},{"attachment":"B","id":"2","resource":6}],"resources":[6]},{"domain":2,"placement":14,"ports":[{"attachment":"A","id":"0","resource":6},{"attachment":"B","id":"1","resource":6},{"attachment":"C","id":"2","resource":6}],"resources":[6]},{"domain":2,"placement":15,"ports":[{"attachment":"A","id":"0","resource":7},{"attachment":"C","id":"1","resource":7},{"attachment":"B","id":"2","resource":7}],"resources":[7]},{"domain":2,"placement":16,"ports":[{"attachment":"B","id":"0","resource":7},{"attachment":"A","id":"1","resource":7},{"attachment":"C","id":"2","resource":7}],"resources":[7]},{"domain":2,"placement":17,"ports":[{"attachment":"C","id":"0","resource":7},{"attachment":"B","id":"1","resource":7},{"attachment":"A","id":"2","resource":7}],"resources":[7]}],"resources":["location/cone/00","location/cone/01","location/cone/02","location/edge/00","location/edge/01","location/edge/02","location/vertex/00","location/vertex/01"]}
